title,link,author,date_str
"Шанс для Яценюка, но последний",https://ukraina.ru/20151211/1015050092.html,Российский миротворец,"11 декабря 2015, 09:23"
Как украинские ученые у Яценюка милостыню просили,https://ukraina.ru/20151210/1015044866.html,Трымава.рф,"10 декабря 2015, 13:50"
Украину ждет угольный майдан?,https://ukraina.ru/20151210/1015042831.html,Одна Родина,"10 декабря 2015, 12:22"
Прорыв в «це Европу»,https://ukraina.ru/20151210/1015039761.html,Свободная Пресса,"10 декабря 2015, 09:55"
«Збройні Сили та їхній Вечір»,https://ukraina.ru/20151209/1015038447.html,Егор Воронов,"9 декабря 2015, 17:54"
Как украинцы в Европе выкуп требовали,https://ukraina.ru/20151209/1015036058.html,Павел Шипилин,"9 декабря 2015, 15:13"
Почему Байден призвал к федерализации Украины?,https://ukraina.ru/20151209/1015033803.html,Александр Чаленко,"9 декабря 2015, 12:02"
«Такого геноцида Украина еще не знала». Гость из Канады пришел в ужас от состояния Киева,https://ukraina.ru/20151209/1015032678.html,MetrPrice.ru,"9 декабря 2015, 11:05"
Чем постсоветские failed states отличаются от финского национального проекта?,https://ukraina.ru/20151209/1015031710.html,«Взгляд»,"9 декабря 2015, 09:40"
Охота на ведьм – примета нынешней Украины?,https://ukraina.ru/20151208/1015028477.html,Алла Александровская,"8 декабря 2015, 15:51"
Джульетто Кьеза: Агрессивный узел вокруг России завязывается. Мы идем к войне,https://ukraina.ru/20151208/1015024392.html,Антифашист,"8 декабря 2015, 10:42"
Василий Волга: На сегодняшний день Украина – это самая крупная колония США,https://ukraina.ru/20151208/1015023915.html,Алена Сергеева,"8 декабря 2015, 10:21"
"Марко Рубио: Американцы напуганы не террористами, а своим президентом",https://ukraina.ru/20151208/1015023680.html,Владимир Корнилов,"8 декабря 2015, 09:58"
В Русский мир - с российским паспортом,https://ukraina.ru/20151207/1015020680.html,Александр Чаленко,"7 декабря 2015, 16:44"
Какая связь между сбитым российским самолётом и нашими раскольниками?,https://ukraina.ru/20151207/1015018188.html,Спілка православних журналістів,"7 декабря 2015, 12:51"
Большая ложь в маленьком селе,https://ukraina.ru/20151207/1015017081.html,,"7 декабря 2015, 10:58"
The Most Important News: Россия поймала США и Турцию на грандиозной лжи,https://ukraina.ru/20151206/1015012274.html,The Most Important News,"6 декабря 2015, 15:35"
"Французский историк: Европа слепа, если видит врага в России",https://ukraina.ru/20151206/1015009703.html,Europe 1,"6 декабря 2015, 12:37"
"Время «Ч»: 8 декабря истекает срок, который Россия дала Украине на размышление",https://ukraina.ru/20151206/1015006353.html,Комсомольская правда в Украине,"6 декабря 2015, 09:29"
"Выступление Путина. Не об Украине, но о восстановлении суверенитета",https://ukraina.ru/20151205/1015004927.html,Александр Дудчак,"5 декабря 2015, 18:41"
"ОБСЕ прислушивается к России, или Почему Порошенко потерял чувство страха",https://ukraina.ru/20151205/1015004034.html,Харьков,"5 декабря 2015, 17:40"
Демузеизация всей страны?,https://ukraina.ru/20151205/1015003045.html,ЛIВА,"5 декабря 2015, 16:11"
В Киеве недовольны Обамой,https://ukraina.ru/20151205/1015000994.html,Свободная Пресса,"5 декабря 2015, 14:15"
Разменные души,https://ukraina.ru/20151204/1014994942.html,Марина Прокопенко,"4 декабря 2015, 17:20"
Взорвавшие сами себя,https://ukraina.ru/20151204/1014991461.html,Платон Беседин,"4 декабря 2015, 12:40"
"Гибридная война Турчинова, заподозрившего Франсуа Олланда в безумии",https://ukraina.ru/20151204/1014989238.html,Одна Родина,"4 декабря 2015, 10:57"
Туркаина или Укрция,https://ukraina.ru/20151203/1014986809.html,Политнавигатор,"3 декабря 2015, 18:17"
Полная пазуха достоинства,https://ukraina.ru/20151203/1014983523.html,Артемий Василенко,"3 декабря 2015, 13:57"
Обыски глав «меджлиса» в Крыму могут выявить турецкий след,https://ukraina.ru/20151203/1014981107.html,Харьков,"3 декабря 2015, 11:41"
Как Турция пытается использовать Крым в противостоянии с РФ,https://ukraina.ru/20151202/1014977958.html,,"2 декабря 2015, 17:58"
Бросают ли русские своих?,https://ukraina.ru/20151202/1014977087.html,Олег  Царев,"2 декабря 2015, 17:01"
Эти дни,https://ukraina.ru/20151201/1014966818.html,Александр Зубченко,"1 декабря 2015, 15:03"
Американская военная помощь Украине: разворованный хлам,https://ukraina.ru/20151201/1014965763.html,Журналистская правда,"1 декабря 2015, 13:55"
С газа на дрова,https://ukraina.ru/20151201/1014962097.html,Комсомольская правда в Украине,"1 декабря 2015, 10:32"
Мариуполь – город ватный,https://ukraina.ru/20151130/1014959025.html,Александр Чаленко,"30 ноября 2015, 16:31"
Мариуполь — на выборы сквозь строй,https://ukraina.ru/20151129/1014953875.html,«Досье - Киев»,"29 ноября 2015, 18:37"
Взрывали и будем взрывать,https://ukraina.ru/20151129/1014952709.html,manzal,"29 ноября 2015, 17:24"
Декоммунизация и УИНП. От театра «Варьете» до Аненербе,https://ukraina.ru/20151129/1014952042.html,Фонд Стратегической Культуры,"29 ноября 2015, 16:38"
Осторожно! ГМО из Украины,https://ukraina.ru/20151129/1014951499.html,Свободная Пресса,"29 ноября 2015, 15:59"
О деструктивных действиях киевских властей,https://ukraina.ru/20151129/1014950977.html,,"29 ноября 2015, 15:09"
О создании группы «За свободный Кавказ» во главе с Шухевичем,https://ukraina.ru/20151128/1014946693.html,Харьков,"28 ноября 2015, 18:43"
"Севастополь убедился, что правильно проголосовал на референдуме «не в пользу дураков»",https://ukraina.ru/20151128/1014943317.html,,"28 ноября 2015, 14:54"
"Украина мечтает сбивать российские самолеты, «как Турция»",https://ukraina.ru/20151128/1014940990.html,Российский миротворец,"28 ноября 2015, 11:36"
Благодатное дарование Паисия Величковского,https://ukraina.ru/20151128/1014940190.html,Одна Родина,"28 ноября 2015, 10:25"
Турецкий синдром Киева,https://ukraina.ru/20151127/1014938517.html,Свободная Пресса,"27 ноября 2015, 18:47"
"Крым избавляется от всего, что связано с Украиной",https://ukraina.ru/20151127/1014933641.html,Контекст,"27 ноября 2015, 13:39"
"Готовь, Европа, противогаз: украинский атом идет на вас…",https://ukraina.ru/20151127/1014932471.html,Мир и мы,"27 ноября 2015, 12:02"
Эксперты: Турчинова можно считать соучастником уничтожения российского Су-24,https://ukraina.ru/20151126/1014926209.html,,"26 ноября 2015, 16:25"
"Экономическая война с Россией: Украине по-прежнему есть, что терять",https://ukraina.ru/20151126/1014921490.html,Комсомольская правда в Украине,"26 ноября 2015, 10:31"
Le Figaro: Обама и Эрдоган выступают за снятие напряженности,https://ukraina.ru/20151125/1014918408.html,Le Figaro,"25 ноября 2015, 17:04"
«Иерей-сан. Исповедь самурая»: Фильм-откровение,https://ukraina.ru/20151125/1014917953.html,Александр Добродомов,"25 ноября 2015, 16:35"
"CounterPunch: Уничтожение Су-24 Турцией было безумием, спровоцированным США",https://ukraina.ru/20151125/1014913620.html,CounterPunch,"25 ноября 2015, 11:10"
Грехи Порошенко повесят на Януковича,https://ukraina.ru/20151124/1014911030.html,Свободная Пресса,"24 ноября 2015, 17:15"
Подручному Ахметова не место в Москве,https://ukraina.ru/20151124/1014908873.html,Александр Чаленко,"24 ноября 2015, 15:18"
"Энергоблокада Крыма: дискредитация Украины ценой в $11,6 млн?",https://ukraina.ru/20151124/1014905267.html,Голос.UA,"24 ноября 2015, 11:10"
«Абсолютно невменяемые люди совершили теракт»,https://ukraina.ru/20151123/1014901078.html,«Взгляд»,"23 ноября 2015, 16:28"
Terra Incognita Украина,https://ukraina.ru/20151123/1014895943.html,Павел Шипилин,"23 ноября 2015, 10:18"
К скандалу с продажей оружия боевикам через Турцию и Украину,https://ukraina.ru/20151123/1014895043.html,Веб-проект «Однако»,"23 ноября 2015, 09:38"
Война на востоке Украины продолжается,https://ukraina.ru/20151122/1014891944.html,Российский миротворец,"22 ноября 2015, 17:11"
Украинская армия рядится в символику старых врагов России,https://ukraina.ru/20151122/1014891073.html,Харьков,"22 ноября 2015, 16:22"
"Обесточивание Крыма, или Как Порошенко отвлекает внимание украинцев от своих неудач",https://ukraina.ru/20151122/1014890506.html,,"22 ноября 2015, 15:58"
Инглишизация Украины в честь свободы от достоинства,https://ukraina.ru/20151122/1014886822.html,Одна Родина,"22 ноября 2015, 09:55"
«Яценюк очень хотел пулю в лоб – так пусть ее получит!»,https://ukraina.ru/20151121/1014884016.html,,"21 ноября 2015, 19:12"
Долг платежом... не красен,https://ukraina.ru/20151121/1014885231.html,Александр Русин,"21 ноября 2015, 17:30"
«Газпром» не получил предоплату от «Нафтогаза». Ситуация стабильна?,https://ukraina.ru/20151121/1014883744.html,Валентин Землянский,"21 ноября 2015, 15:58"
Порошенко срывает ордена,https://ukraina.ru/20151121/1014880290.html,Свободная Пресса,"21 ноября 2015, 10:49"
Как киевский ватник вступил в связь с потусторонним миром,https://ukraina.ru/20151120/1014874799.html,,"20 ноября 2015, 13:48"
Дуремар возвращается? А он никуда и не уходил…,https://ukraina.ru/20151120/1014874293.html,Игорь Перминов,"20 ноября 2015, 13:05"
"Римские каникулы: лягающийся Парасюк, крадущий Мартыненко",https://ukraina.ru/20151120/1014872663.html,Александр Зубченко,"20 ноября 2015, 11:18"
Порошенко меняет в паспортах Украины «язык оккупантов» на «язык кредиторов»?,https://ukraina.ru/20151120/1014871696.html,EADaily,"20 ноября 2015, 09:59"
Порошенко продолжает саботировать Минск-2,https://ukraina.ru/20151119/1014869927.html,Александр Чаленко,"19 ноября 2015, 19:08"
Одесские антифашисты: Саакашвили контактирует с ИГ через участников бойни 2 мая,https://ukraina.ru/20151119/1014867514.html,EADaily,"19 ноября 2015, 15:50"
Пора бомбить УГИЛ,https://ukraina.ru/20151119/1014867101.html,Журналистская правда,"19 ноября 2015, 15:03"
Последние времена,https://ukraina.ru/20151119/1014865158.html,Платон Беседин,"19 ноября 2015, 12:20"
Протоколы львовских мудрецов,https://ukraina.ru/20151119/1014862449.html,Иван Мирный,"19 ноября 2015, 09:18"
Россия — Украина: операция «реструктуризация»,https://ukraina.ru/20151118/1014854403.html,EADaily,"18 ноября 2015, 09:32"
Львов: СВОБОДные выборы на садовом участке,https://ukraina.ru/20151117/1014850882.html,Одна Родина,"17 ноября 2015, 16:48"
О перспективах Халифата Европейского Союза,https://ukraina.ru/20151117/1014850089.html,Андрей Ваджра,"17 ноября 2015, 15:55"
Террористическая яма для Европы,https://ukraina.ru/20151117/1014848232.html,Фонд Стратегической Культуры,"17 ноября 2015, 12:53"
Брюссель просит Москву пощадить Киев,https://ukraina.ru/20151116/1014842944.html,Свободная Пресса,"16 ноября 2015, 16:49"
«Укропская демократия» в Днепропетровске: Филатов фальсифицирует выборы,https://ukraina.ru/20151116/1014839005.html,Александр Чаленко,"16 ноября 2015, 13:15"
Бремя выбора,https://ukraina.ru/20151116/1014837940.html,Платон Беседин,"16 ноября 2015, 12:12"
Киевляне выбирали из двух зол — меньшее,https://ukraina.ru/20151116/1014836773.html,Полина Орловская,"16 ноября 2015, 11:14"
Саакашвили. Прощай Одесса!?,https://ukraina.ru/20151116/1014836199.html,tergparriotio,"16 ноября 2015, 10:29"
Яценюк уйдет вместе с Украиной,https://ukraina.ru/20151115/1014833117.html,Свободная Пресса,"15 ноября 2015, 17:01"
Старушка доигралась,https://ukraina.ru/20151115/1014832525.html,Александр Русин,"15 ноября 2015, 16:16"
ЛГБТ при поддержке Сороса займутся воспитанием украинских детей,https://ukraina.ru/20151115/1014830275.html,Фонд Стратегической Культуры,"15 ноября 2015, 13:30"
Военный психоз на Украине наконец начал спадать,https://ukraina.ru/20151114/1014824960.html,«Взгляд»,"14 ноября 2015, 16:28"
Украинское эхо французских терактов,https://ukraina.ru/20151114/1014824597.html,Антифашист,"14 ноября 2015, 15:36"
Франция. Париж. Ад.,https://ukraina.ru/20151114/1014821747.html,,"14 ноября 2015, 12:12"
Украина перешла на сторону геев,https://ukraina.ru/20151114/1014820273.html,EADaily,"14 ноября 2015, 10:30"
Более 150 человек погибли в результате крупнейшего теракта в истории Франции,https://ukraina.ru/20151114/1014819608.html,Russia Today,"14 ноября 2015, 09:47"
Сергей Бубка: ИААФ не следует наказывать невиновных российских спортсменов,https://ukraina.ru/20151113/1014817651.html,Associated Press,"13 ноября 2015, 17:20"
Украина: пятница 13-е,https://ukraina.ru/20151113/1014816903.html,Александр Зубченко,"13 ноября 2015, 16:27"
Яценюк «победил» неизвестных олигархов,https://ukraina.ru/20151113/1014810638.html,Правда.Ру,"13 ноября 2015, 10:02"
Запрещенное слово,https://ukraina.ru/20151112/1014806227.html,Игорь Плисюк,"12 ноября 2015, 14:32"
"Политические сценки «Вечернего квартала», которые так и не увидел зритель",https://ukraina.ru/20151112/1014802485.html,Комсомольская правда в Украине,"12 ноября 2015, 11:58"
"Почему Ярош сообщил, что больше не хочет руководить «Правым сектором»",https://ukraina.ru/20151111/1014798448.html,Харьков,"11 ноября 2015, 17:39"
"Куда идешь, Украина?",https://ukraina.ru/20151111/1014794459.html,Марина Прокопенко,"11 ноября 2015, 13:49"
СБУ наступила на хвост слишком большого «клубка змей»,https://ukraina.ru/20151111/1014792660.html,Харьков,"11 ноября 2015, 11:17"
За и против незалежности,https://ukraina.ru/20151111/1014791833.html,Александр Русин,"11 ноября 2015, 10:36"
Зачем Киев снова провоцирует силовой сценарий в Донбассе?,https://ukraina.ru/20151110/1014789636.html,Алексей Мухин,"10 ноября 2015, 19:15"
"Каталония — не Испания, Украина — не Европа",https://ukraina.ru/20151110/1014787545.html,Журналистская правда,"10 ноября 2015, 16:19"
Гражданскую войну на Украине начал Коломойский,https://ukraina.ru/20151110/1014785329.html,Свободная Пресса,"10 ноября 2015, 13:26"
"Песня Саакашвили спета, Коломойского ждет еще одна пощечина",https://ukraina.ru/20151110/1014784308.html,Федеральное агентство новостей,"10 ноября 2015, 12:11"
"Мемориальную доску облили краской, написав «Жиды, сдохните!»",https://ukraina.ru/20151110/1014782311.html,Полина Орловская,"10 ноября 2015, 10:00"
"«Скорее будет трибунал над хунтой, чем безвизовый режим для Украины»",https://ukraina.ru/20151109/1014780208.html,Харьков,"9 ноября 2015, 18:58"
«Свободовца» покарал «правосек»,https://ukraina.ru/20151109/1014778543.html,Александр Чаленко,"9 ноября 2015, 16:43"
Украина двинула ЕС бутылкой по голове,https://ukraina.ru/20151109/1014777992.html,Свободная Пресса,"9 ноября 2015, 16:06"
Испытание миром,https://ukraina.ru/20151109/1014773912.html,Павел Шипилин,"9 ноября 2015, 10:35"
Крым и двойные стандарты Запада,https://ukraina.ru/20151109/1014773005.html,Telesur TV,"9 ноября 2015, 10:00"
«Немножко отклонился от курса»: когда уйдёт Арсений Яценюк?,https://ukraina.ru/20151108/1014768978.html,EADaily,"8 ноября 2015, 15:03"
Американский пряник для Порошенко,https://ukraina.ru/20151108/1014768701.html,Свободная Пресса,"8 ноября 2015, 14:35"
"СЕ: Мир осудит Украину, если не будут расследованы убийства на майдане и в Одессе",https://ukraina.ru/20151108/1014768091.html,Russia Today,"8 ноября 2015, 13:54"
Освободитель Киева для «незалежной» - не герой?,https://ukraina.ru/20151107/1014762591.html,Издание «Континенталистъ»,"7 ноября 2015, 15:35"
"Руслан Веснянко: Почему европейцы боятся украинцев больше, чем беженцев-мусульман",https://ukraina.ru/20151107/1014760756.html,EADaily,"7 ноября 2015, 13:32"
Подонки из Charlie Hebdo - это Европа?,https://ukraina.ru/20151107/1014759641.html,Фонд Стратегической Культуры,"7 ноября 2015, 11:42"
Планета Обезьян: Эволюция украинского парламентаризма,https://ukraina.ru/20151107/1014758413.html,Журналистская правда,"7 ноября 2015, 10:12"
Bloomberg View: США и ЕС провалили проект «Украина»,https://ukraina.ru/20151107/1014757840.html,Bloomberg View,"7 ноября 2015, 09:37"
RFI: Порошенко предал майдан ради личного обогащения,https://ukraina.ru/20151106/1014753115.html,RFI,"6 ноября 2015, 13:24"
Заклинатели смерти,https://ukraina.ru/20151106/1014752795.html,Платон Беседин,"6 ноября 2015, 13:03"
Как Кировоград подставил Мариуполь,https://ukraina.ru/20151106/1014752288.html,Комсомольская правда в Украине,"6 ноября 2015, 12:38"
Кадровая политика Киева возвращает Украину в СССР,https://ukraina.ru/20151106/1014752061.html,«Взгляд»,"6 ноября 2015, 12:23"
Трагедия безвизового режима,https://ukraina.ru/20151106/1014751452.html,Александр Зубченко,"6 ноября 2015, 11:51"
К годовщине Октября – размышления с приключениями,https://ukraina.ru/20151106/1014733169.html,,"6 ноября 2015, 09:00"
Новый виток войны в Донбассе: месть за Сирию или «самодеятельность» Порошенко?,https://ukraina.ru/20151105/1014744525.html,Журналистская правда,"5 ноября 2015, 15:08"
Из Нью-Йорка в Донбасс — официально,https://ukraina.ru/20151105/1014740760.html,Свободная Пресса,"5 ноября 2015, 10:03"
Мы не скачем. Почему русские не пришли на «русские марши»,https://ukraina.ru/20151105/1014740073.html,Веб-проект «Однако»,"5 ноября 2015, 09:31"
Кто это сказал?,https://ukraina.ru/20151104/1014738251.html,Павел Шипилин,"4 ноября 2015, 18:18"
"Лишившись покровителей, Ярош открыто предлагает услуги Ахметову",https://ukraina.ru/20151104/1014737225.html,Харьков,"4 ноября 2015, 17:24"
Герои Майдана: ландскнехты хаоса. Теперь в Черногории,https://ukraina.ru/20151104/1014735478.html,Журналистская правда,"4 ноября 2015, 15:32"
Что затеяли американцы на Украине?,https://ukraina.ru/20151104/1014732413.html,Правда.Ру,"4 ноября 2015, 11:37"
"Власть должна понять, что ею очень недовольны",https://ukraina.ru/20151103/1014728521.html,Полина Орловская,"3 ноября 2015, 19:05"
"Корбан, Вилкул, Новинский и другие. Видимость симметрии",https://ukraina.ru/20151103/1014725058.html,Yurasumy,"3 ноября 2015, 15:08"
Заявление Керри — США признали свое поражение на Украине,https://ukraina.ru/20151103/1014722819.html,ИА Regnum,"3 ноября 2015, 12:40"
"Реституция во имя ассоциации, или Что Украина должна Польше",https://ukraina.ru/20151103/1014722007.html,Андрей Ваджра,"3 ноября 2015, 12:08"
Ярош сложил оружие,https://ukraina.ru/20151103/1014720407.html,Павел Шипилин,"3 ноября 2015, 10:28"
Польский Львов и «историческая политика» Украины,https://ukraina.ru/20151102/1014717325.html,Одна Родина,"2 ноября 2015, 17:42"
Героям страшно: «полупроводник» украинского национализма Ярош,https://ukraina.ru/20151102/1014715824.html,Журналистская правда,"2 ноября 2015, 16:14"
