title,link,author,date_str
Империи наносят ответный удар. Эпизод IV,https://ukraina.ru/20211115/1032660054.html,Дмитрий Выдрин,"15 ноября 2021, 12:50"
«Падающего — подтолкни»? Тарас Креминь как «полезный идиот» Москвы,https://ukraina.ru/20211112/1032642509.html,Константин Кеворкян,"12 ноября 2021, 15:33"
Зеленский vs Разумков: война Пьеро и Арлекина,https://ukraina.ru/20211112/1032649332.html,Ростислав Ищенко,"12 ноября 2021, 14:42"
Донбасс в шаге от войны,https://ukraina.ru/20211111/1032643728.html,Андрей Бабицкий,"11 ноября 2021, 15:24"
"Геть от цивилизации! Одна нация, одна мова, один гетман",https://ukraina.ru/20211111/1032635906.html,Константин Кеворкян,"11 ноября 2021, 14:59"
Пшепрашам тудей. Польское «гостеприимство» и внезапные гости,https://ukraina.ru/20211110/1032629025.html,Константин Кеворкян,"10 ноября 2021, 09:42"
Галицкие арийцы и «Табель о национальных рангах»,https://ukraina.ru/20211109/1032622272.html,Константин Кеворкян,"9 ноября 2021, 13:06"
Империи наносят ответный удар. Эпизод ΙΙΙ,https://ukraina.ru/20211108/1032613029.html,Дмитрий Выдрин,"8 ноября 2021, 16:03"
Гробы наши тяжкие. Хроники перерождения Украины,https://ukraina.ru/20211108/1032612570.html,Константин Кеворкян,"8 ноября 2021, 12:55"
Кина не будет,https://ukraina.ru/20211107/1032611527.html,Константин Кеворкян,"7 ноября 2021, 14:52"
На смерть Георгия Корнеевича Крючкова,https://ukraina.ru/20211106/1032609042.html,Ростислав Ищенко,"6 ноября 2021, 10:47"
Дикарские развлечения. Шутки и прибаутки современной Украины,https://ukraina.ru/20211105/1032607167.html,Константин Кеворкян,"5 ноября 2021, 11:44"
Зеленский на «зелёном» саммите,https://ukraina.ru/20211103/1032597469.html,Ростислав Ищенко,"3 ноября 2021, 18:24"
Подлый внучек и воины «неизвестной армии»,https://ukraina.ru/20211103/1032592646.html,Константин Кеворкян,"3 ноября 2021, 12:34"
Донбасс и страна артиллерии,https://ukraina.ru/20211103/1032597351.html,,"3 ноября 2021, 09:41"
Империи наносят ответный удар. Эпизод II,https://ukraina.ru/20211102/1032589132.html,Дмитрий Выдрин,"2 ноября 2021, 12:59"
Украина попала в энергетическую блокаду,https://ukraina.ru/20211101/1032583907.html,Андрей Бабицкий,"1 ноября 2021, 16:36"
Миллиард деревьев и ледоколы: как выполняются обещания Зеленского,https://ukraina.ru/20211030/1032569099.html,Андрей  Манчук,"30 октября 2021, 15:03"
"О Слове, Боге и разделённом человечестве и Крошке Еноте",https://ukraina.ru/20211030/1032564515.html,Ростислав Ищенко,"30 октября 2021, 11:04"
Империи наносят ответный удар. Эпизод Ι,https://ukraina.ru/20211029/1032568654.html,Дмитрий Выдрин,"29 октября 2021, 16:23"
Украина в лихорадочном поиске электроэнергии,https://ukraina.ru/20211029/1032568534.html,Андрей Бабицкий,"29 октября 2021, 15:55"
Русское единство: о «продаже» друзей и поддержке врагов,https://ukraina.ru/20211029/1032564058.html,Ростислав Ищенко,"29 октября 2021, 13:19"
Германия: коалиция и судьба «Северного потока — 2»,https://ukraina.ru/20211028/1032558295.html,Ростислав Ищенко,"28 октября 2021, 14:31"
«Дух большевизма остался в прошлом». В Украине уничтожают легендарные предприятия,https://ukraina.ru/20211027/1032554401.html,Андрей  Манчук,"27 октября 2021, 19:06"
Звонок Джонсона: Британия задумалась о неприятном будущем,https://ukraina.ru/20211027/1032547596.html,Ростислав Ищенко,"27 октября 2021, 15:37"
Беглецы и приспособленцы: о причине импотентности украинской оппозиции,https://ukraina.ru/20211026/1032542839.html,Ростислав Ищенко,"26 октября 2021, 18:00"
«Запрет на критику власти». Как работает маккартизм цифровой эпохи,https://ukraina.ru/20211026/1032543347.html,Андрей  Манчук,"26 октября 2021, 17:43"
«Крым-нереалии». Дороги и не очень умные люди,https://ukraina.ru/20211026/1032537925.html,Константин Кеворкян,"26 октября 2021, 09:52"
День Победы России в текущей войне,https://ukraina.ru/20211026/1032537653.html,Ростислав Ищенко,"26 октября 2021, 09:46"
"У Молдавии нет денег, поэтому она хочет получать газ почти даром",https://ukraina.ru/20211025/1032534516.html,Андрей Бабицкий,"25 октября 2021, 15:50"
О причинах российской неторопливости,https://ukraina.ru/20211025/1032531024.html,Ростислав Ищенко,"25 октября 2021, 13:11"
Россия возвращается,https://ukraina.ru/20211023/1032527720.html,Ростислав Ищенко,"23 октября 2021, 17:17"
Россия ещё шире распахнёт объятья русским,https://ukraina.ru/20211022/1032523995.html,Андрей Бабицкий,"22 октября 2021, 15:49"
Российская угроза и информационные агрессоры,https://ukraina.ru/20211022/1032519802.html,Ростислав Ищенко,"22 октября 2021, 10:33"
«Новояз» и «новомова». Оруэлл по-украински,https://ukraina.ru/20211022/1032519539.html,Константин Кеворкян,"22 октября 2021, 10:15"
Вакцинация от коронавируса: работа над ошибками,https://ukraina.ru/20211021/1032514864.html,Андрей  Манчук,"21 октября 2021, 16:50"
Зеленский в свободном падении,https://ukraina.ru/20211021/1032514716.html,Ростислав Ищенко,"21 октября 2021, 16:37"
"Обещал бычка, а дал тычка. Чем увенчался визит главы Пентагона в Киев",https://ukraina.ru/20211020/1032506800.html,Андрей Бабицкий,"20 октября 2021, 16:39"
Газовый пузырь. Лопнет ли диктатура Зеленского,https://ukraina.ru/20211020/1032502584.html,Константин Кеворкян,"20 октября 2021, 15:45"
Небесспорные мысли. Как очистить «Звезду Полынь» от предательства,https://ukraina.ru/20211020/1032503533.html,Ростислав Ищенко,"20 октября 2021, 14:50"
Украина на грани. Топливный кризис на пороге,https://ukraina.ru/20211019/1032493217.html,Андрей Бабицкий,"19 октября 2021, 10:18"
"Боевые психопаты, или «Козаки» получают всё",https://ukraina.ru/20211019/1032492948.html,Константин Кеворкян,"19 октября 2021, 10:04"
Россия поднимает ставки,https://ukraina.ru/20211019/1032492876.html,Ростислав Ищенко,"19 октября 2021, 09:52"
Аллея Свободы слова возле американского посольства в Киеве,https://ukraina.ru/20211018/1032487832.html,Андрей  Манчук,"18 октября 2021, 15:21"
Есть ли завтра война? Где начнется Третья мировая война,https://ukraina.ru/20211018/1032485562.html,Дмитрий Выдрин,"18 октября 2021, 14:27"
Взращенные в ненависти. Гитлерюгенд в жовто-блакитных тонах,https://ukraina.ru/20211017/1032473713.html,Константин Кеворкян,"17 октября 2021, 11:53"
Как борются с коронавирусом в ДНР,https://ukraina.ru/20211015/1032479672.html,Андрей Бабицкий,"15 октября 2021, 18:19"
Виктория Нуланд и свободный рынок,https://ukraina.ru/20211015/1032473892.html,Ростислав Ищенко,"15 октября 2021, 09:53"
Украина входит в зиму полностью неподготовленной,https://ukraina.ru/20211014/1032468285.html,Андрей Бабицкий,"14 октября 2021, 16:26"
Чего мы еще ждем от Украины,https://ukraina.ru/20211014/1032464305.html,Константин Кеворкян,"14 октября 2021, 13:35"
Русские пришли. Мы виноваты во всем,https://ukraina.ru/20211013/1032453795.html,Константин Кеворкян,"13 октября 2021, 10:59"
Сброд во власти. Разложение как фактор управления,https://ukraina.ru/20211012/1032446207.html,Константин Кеворкян,"12 октября 2021, 15:18"
«На ослабление России»: кого и зачем в РФ финансирует британское правительство,https://ukraina.ru/20211012/1032441960.html,Геворг  Мирзаян,"12 октября 2021, 11:43"
Остров Липно: крупица большой истории,https://ukraina.ru/20211011/1032435075.html,Андрей  Манчук,"11 октября 2021, 17:50"
Свобода слова на Западе превратилась в свободу «нужного слова»,https://ukraina.ru/20211011/1032431648.html,Дмитрий Выдрин,"11 октября 2021, 15:04"
Саакашвили: напрасная и глупая жертва,https://ukraina.ru/20211008/1032424996.html,Андрей Бабицкий,"8 октября 2021, 17:58"
Станет ли Разумков Зеленским? Штрихи к портрету «украинского Кеннеди»,https://ukraina.ru/20211008/1032424868.html,Андрей  Манчук,"8 октября 2021, 16:51"
Между войной и войной. К вопросу о денацификации Украины,https://ukraina.ru/20211008/1032418559.html,Константин Кеворкян,"8 октября 2021, 12:42"
«Я ваш приговор». Зеленский и логика бонапартизма,https://ukraina.ru/20211007/1032417659.html,Андрей  Манчук,"7 октября 2021, 18:15"
Много вопросов. Все ли в порядке в нашем королевстве?,https://ukraina.ru/20211007/1032408971.html,Константин Кеворкян,"7 октября 2021, 12:25"
Дорогой газ и действия России,https://ukraina.ru/20211007/1032408607.html,Ростислав Ищенко,"7 октября 2021, 09:39"
Как сбой Facebook помог России,https://ukraina.ru/20211006/1032403768.html,Геворг  Мирзаян,"6 октября 2021, 16:23"
Саблезубые тигры в лесах Закарпатья,https://ukraina.ru/20211006/1032398066.html,Дмитрий Выдрин,"6 октября 2021, 14:27"
Facebook: прибыльная ненависть,https://ukraina.ru/20211006/1032400934.html,Андрей  Манчук,"6 октября 2021, 14:23"
"Разумкова снимают, Рабинович крепчает, Зеленского хоронят",https://ukraina.ru/20211006/1032397652.html,Ростислав Ищенко,"6 октября 2021, 13:07"
Убийцы для охраны упырей. О разгуле украинской преступности,https://ukraina.ru/20211006/1032397882.html,Константин Кеворкян,"6 октября 2021, 10:52"
Удастся ли Зеленскому взять под контроль финансовые потоки госкомпаний,https://ukraina.ru/20211005/1032393361.html,Андрей Бабицкий,"5 октября 2021, 16:34"
Напрасные надежды. «Разрядка-2» как геополитическая ложь,https://ukraina.ru/20211005/1032385084.html,Константин Кеворкян,"5 октября 2021, 12:28"
Электронные больничные: проблемы и перспективы,https://ukraina.ru/20211004/1032385651.html,Андрей  Манчук,"4 октября 2021, 17:33"
Враг России из Донбасса: тревожный опыт одного сериала,https://ukraina.ru/20211002/1032376479.html,Руслан  Мармазов,"2 октября 2021, 17:02"
Уэллс и феминизм: «Анна-Вероника»,https://ukraina.ru/20211002/1032374590.html,Василий  Стоякин,"2 октября 2021, 10:33"
«Как в Прибалтике». Введут ли «паспорт неграждан»?,https://ukraina.ru/20211001/1032373767.html,Андрей  Манчук,"1 октября 2021, 17:57"
"Новая Украина. Десять дней, которые не потрясли мир",https://ukraina.ru/20211001/1032356875.html,Константин Кеворкян,"1 октября 2021, 08:27"
Бабий Яр: виноваты коммунисты и партизаны,https://ukraina.ru/20210930/1032364416.html,Андрей  Манчук,"30 сентября 2021, 17:25"
Зеленский и олигархи: кто кого съест,https://ukraina.ru/20210929/1032349470.html,Ростислав Ищенко,"29 сентября 2021, 14:13"
Третья роковая ошибка Германии,https://ukraina.ru/20210929/1032346275.html,Ростислав Ищенко,"29 сентября 2021, 10:08"
Почему Западу не нужно вступление Украины в НАТО,https://ukraina.ru/20210928/1032338273.html,Ростислав Ищенко,"28 сентября 2021, 13:08"
Конфликт вокруг Косово: игра на обострение,https://ukraina.ru/20210927/1032335452.html,Андрей  Манчук,"27 сентября 2021, 17:44"
Германские выборы: тайна долей процента,https://ukraina.ru/20210927/1032329561.html,Ростислав Ищенко,"27 сентября 2021, 09:35"
Новый друг хуже старых двух. Турецкий гроссмейстер и украинская пешка,https://ukraina.ru/20210926/1032326991.html,Геворг  Мирзаян,"26 сентября 2021, 12:36"
Байден удивил и обрадовал,https://ukraina.ru/20210923/1032308347.html,Ростислав Ищенко,"23 сентября 2021, 13:34"
Новости из жовто-блакитного дома,https://ukraina.ru/20210923/1032303523.html,Константин Кеворкян,"23 сентября 2021, 13:22"
Байден провозгласил эру «беспощадной дипломатии»: что дальше?,https://ukraina.ru/20210922/1032304633.html,Геворг  Мирзаян,"22 сентября 2021, 18:22"
Они говорят «демократия». И вы говорите,https://ukraina.ru/20210922/1032295898.html,Константин Кеворкян,"22 сентября 2021, 15:14"
Отмена профсоюзов. В Украине декоммунизировали Первомай вместе с Трудовым кодексом,https://ukraina.ru/20210922/1032295217.html,Андрей  Манчук,"22 сентября 2021, 09:40"
Итоги выборов в Госдуму: как изменится политика России по отношению к Донбассу и Украине,https://ukraina.ru/20210921/1032294874.html,Андрей Бабицкий,"21 сентября 2021, 18:38"
Рекордный свист,https://ukraina.ru/20210920/1032284839.html,Андрей  Манчук,"20 сентября 2021, 18:26"
Альтернатива «Русскому миру»,https://ukraina.ru/20210920/1032276259.html,Ростислав Ищенко,"20 сентября 2021, 10:13"
Как закошмарить журналистику и общество,https://ukraina.ru/20210917/1032274486.html,Андрей Бабицкий,"17 сентября 2021, 17:39"
17 сентября: день воссоединения Украины,https://ukraina.ru/20210917/1032273773.html,Андрей  Манчук,"17 сентября 2021, 16:10"
Оптимистическая трагедия. «Зрада» подкралась незаметно,https://ukraina.ru/20210917/1032269345.html,Константин Кеворкян,"17 сентября 2021, 09:15"
«Русский мир» как глобальный проект,https://ukraina.ru/20210916/1032260829.html,Ростислав Ищенко,"16 сентября 2021, 10:50"
Израильские фантазии министра Кулебы,https://ukraina.ru/20210915/1032255483.html,Геворг  Мирзаян,"15 сентября 2021, 14:42"
Франчетти должен вернуться домой,https://ukraina.ru/20210914/1032249636.html,Андрей Бабицкий,"14 сентября 2021, 15:55"
"Украина подвешенная. Ни войны, ни мира",https://ukraina.ru/20210914/1032247940.html,Константин Кеворкян,"14 сентября 2021, 14:00"
Похищение Франчетти. Нельзя молчать - доказано Украиной,https://ukraina.ru/20210914/1032243578.html,Константин Кеворкян,"14 сентября 2021, 06:56"
Жить стало лучше и веселее! Почему в Украине заговорили о процветании,https://ukraina.ru/20210913/1032241423.html,Андрей  Манчук,"13 сентября 2021, 15:25"
Новая кормушка. Запад продолжает кормить националистов,https://ukraina.ru/20210912/1032237242.html,Константин Кеворкян,"12 сентября 2021, 15:54"
"Визит Лукашенко в Москву: ""...И бронепоезд на запАсном пути""",https://ukraina.ru/20210910/1032225437.html,Ростислав Ищенко,"10 сентября 2021, 12:28"
«Нормандский формат» практически мёртв. Что дальше?,https://ukraina.ru/20210909/1032221345.html,Андрей Бабицкий,"9 сентября 2021, 16:44"
«Северный поток – 2» — новое качество газовых войн,https://ukraina.ru/20210909/1032216371.html,Ростислав Ищенко,"9 сентября 2021, 10:54"
Кого надо расисты. Почему в Украине замяли дело об оскорблениях в адрес Жана Беленюка,https://ukraina.ru/20210908/1032213078.html,Андрей  Манчук,"8 сентября 2021, 16:39"
Русский Донбасс становится единым,https://ukraina.ru/20210908/1032211210.html,Андрей Бабицкий,"8 сентября 2021, 15:21"
Чьих будете? «Расцвет» национальной культуры и жаборотых пиитов Украины,https://ukraina.ru/20210908/1032210127.html,Константин Кеворкян,"8 сентября 2021, 13:22"
Почему не удалась очередная попытка диверсии в Крыму,https://ukraina.ru/20210907/1032202463.html,Андрей Бабицкий,"7 сентября 2021, 14:45"
Сигнал на старт. Харьковские перегонки за кресло мэра,https://ukraina.ru/20210907/1032196578.html,Константин Кеворкян,"7 сентября 2021, 14:45"
«Защита Зеленского» и военная угроза,https://ukraina.ru/20210907/1032199524.html,Ростислав Ищенко,"7 сентября 2021, 09:43"
«Даешь десятилетие без метро!» Киевлян опять обманули,https://ukraina.ru/20210906/1032197246.html,Андрей  Манчук,"6 сентября 2021, 17:25"
"Врали и будут врать, или Вор кричит громче всех",https://ukraina.ru/20210906/1032191547.html,Константин Кеворкян,"6 сентября 2021, 11:50"
"""Снялись с крючка""? К чему приведут новые инициативы Украины",https://ukraina.ru/20210905/1032190800.html,Геворг  Мирзаян,"5 сентября 2021, 10:33"
СУГСом по дидуху. Страна невыученных рекордов,https://ukraina.ru/20210905/1032184429.html,Константин Кеворкян,"5 сентября 2021, 09:48"
"Музыкант, победивший хунту",https://ukraina.ru/20210903/1032187860.html,Андрей  Манчук,"3 сентября 2021, 17:57"
Еврофрения. Психические отклонения как норма,https://ukraina.ru/20210903/1032168925.html,Константин Кеворкян,"3 сентября 2021, 07:14"
Украина-Русь и американский суперкредит,https://ukraina.ru/20210902/1032178286.html,Андрей  Манчук,"2 сентября 2021, 15:37"
Донбасское танго на переговорах в Вашингтоне,https://ukraina.ru/20210902/1032178780.html,Андрей Бабицкий,"2 сентября 2021, 15:28"
"Укрусь, но не сдамся! Деньги для диктатуры националистов",https://ukraina.ru/20210902/1032176403.html,Константин Кеворкян,"2 сентября 2021, 13:16"
Победитель Зеленский и побеждённая Украина,https://ukraina.ru/20210902/1032167459.html,Ростислав Ищенко,"2 сентября 2021, 07:36"
Водородные грезы Зеленского,https://ukraina.ru/20210901/1032167814.html,Андрей Бабицкий,"1 сентября 2021, 15:09"
"Гости из прошлого, или «Укроафганский синдром»",https://ukraina.ru/20210901/1032161297.html,Константин Кеворкян,"1 сентября 2021, 07:18"
Неученье – тьма. Почему закрывают школы,https://ukraina.ru/20210901/1032158638.html,Андрей  Манчук,"1 сентября 2021, 07:10"
Зеленский повышает ставки,https://ukraina.ru/20210831/1032151296.html,Ростислав Ищенко,"31 августа 2021, 07:34"
«Северный поток - 2»: промежуточный финиш,https://ukraina.ru/20210830/1032146571.html,Ростислав Ищенко,"30 августа 2021, 10:33"
СБУ и хвост Русалочки,https://ukraina.ru/20210828/1032142142.html,Ростислав Ищенко,"28 августа 2021, 09:48"
Пелевин и будни трансгуманизма,https://ukraina.ru/20210827/1032141537.html,Андрей  Манчук,"27 августа 2021, 18:45"
Украина в ожидании алых парусов,https://ukraina.ru/20210827/1032139002.html,Ростислав Ищенко,"27 августа 2021, 15:38"
Новый мир и политическая диалектика,https://ukraina.ru/20210827/1032135159.html,Ростислав Ищенко,"27 августа 2021, 07:25"
Афганские уроки для Украины,https://ukraina.ru/20210826/1032134519.html,Андрей  Манчук,"26 августа 2021, 18:28"
Опасный символизм Зеленского,https://ukraina.ru/20210825/1032121068.html,Ростислав Ищенко,"25 августа 2021, 07:50"
Триумф дикости. Послесловие к недавнему празднику,https://ukraina.ru/20210825/1032120905.html,Константин Кеворкян,"25 августа 2021, 07:40"
Жидкое золото Полуботка,https://ukraina.ru/20210824/1032114378.html,Андрей  Манчук,"24 августа 2021, 12:15"
«Крымская платформа»: новый конфуз Украины,https://ukraina.ru/20210824/1032112816.html,Геворг  Мирзаян,"24 августа 2021, 10:45"
Что не так с независимостью Украины? Глазное уравнение с тремя неизвестными,https://ukraina.ru/20210822/1032102597.html,Захар  Виноградов,"22 августа 2021, 13:56"
Что знает Меркель? О целях и последствиях двойного визита,https://ukraina.ru/20210822/1032101896.html,Ростислав Ищенко,"22 августа 2021, 10:23"
