title,link,author,date_str
Попросил новых санкций против России: Пустые хлопоты Владимира Зеленского,https://ukraina.ru/20190521/1023657295.html,Андрей Бабицкий,"21 мая 2019, 16:03"
Обращение РФ в СБ ООН должно стимулировать Украину и ее партнеров к адекватным действиям,https://ukraina.ru/20190521/1023649830.html,Ростислав Ищенко,"21 мая 2019, 06:55"
Зеленский на троне: финал и начало «Игры престолов»,https://ukraina.ru/20190520/1023644857.html,Андрей  Манчук,"20 мая 2019, 15:39"
"Инаугурационное послевкусие. На Украине происходит смена декораций, а не сути режима",https://ukraina.ru/20190520/1023636810.html,Василий  Стоякин,"20 мая 2019, 11:46"
"Украина: новая власть, старые проблемы",https://ukraina.ru/20190520/1023634494.html,Ростислав Ищенко,"20 мая 2019, 09:08"
Споткнулся на ровном месте. Как Зеленский хоронит российско-украинские переговоры,https://ukraina.ru/20190518/1023630293.html,Андрей Бабицкий,"18 мая 2019, 18:04"
Киев: перезагрузка власти и судьба Порошенко,https://ukraina.ru/20190518/1023628664.html,Ростислав Ищенко,"18 мая 2019, 13:30"
"Вопрос о мире, вопрос о парламенте или Дней Зеленского прекрасное начало",https://ukraina.ru/20190518/1023625373.html,Константин Кеворкян,"18 мая 2019, 11:16"
"Помпезные и затрапезные истории из жизни Мирчи Луческу, величайшего тренера времен футбольной независимости Украины",https://ukraina.ru/20190518/1023584485.html,Руслан  Мармазов,"18 мая 2019, 06:00"
Почему Украина - не Венесуэла,https://ukraina.ru/20190515/1023600672.html,Андрей  Манчук,"15 мая 2019, 18:33"
Атака мертвецов. О врагах всего живого,https://ukraina.ru/20190515/1023597457.html,Константин Кеворкян,"15 мая 2019, 17:30"
Украина без колес,https://ukraina.ru/20190514/1023585504.html,Андрей  Манчук,"14 мая 2019, 19:12"
По стопам Надежды Савченко: новоизбранный президент в роли комика,https://ukraina.ru/20190514/1023585272.html,Андрей Бабицкий,"14 мая 2019, 18:55"
"Кибер-войны света и тьмы, или Незаметная конференция в Харькове",https://ukraina.ru/20190514/1023577501.html,Константин Кеворкян,"14 мая 2019, 12:52"
Тень украинской «Мрии» над EBИNNALE,https://ukraina.ru/20190513/1023571594.html,Андрей  Манчук,"13 мая 2019, 18:33"
Джулиани определил геополитическую позицию Украины,https://ukraina.ru/20190513/1023570971.html,Ростислав Ищенко,"13 мая 2019, 17:33"
"Особенности национальной любви, или Святые чувства на службе патриотов",https://ukraina.ru/20190513/1023566726.html,Константин Кеворкян,"13 мая 2019, 13:55"
Кровь и роскошь донецкого выбора,https://ukraina.ru/20190511/1023529552.html,Руслан  Мармазов,"11 мая 2019, 06:15"
Гитлер жив? Что роднит негодяев,https://ukraina.ru/20190510/1023559139.html,Константин Кеворкян,"10 мая 2019, 14:00"
Метод Авакова,https://ukraina.ru/20190510/1023558575.html,Ростислав Ищенко,"10 мая 2019, 11:26"
Наша Победа,https://ukraina.ru/20190509/1023556712.html,Андрей Бабицкий,"9 мая 2019, 17:15"
Параноидальные фантазии украинских «экспертов»,https://ukraina.ru/20190508/1023548163.html,Андрей Бабицкий,"8 мая 2019, 18:29"
Спасение Европы: 70 лет назад в Берлине открыли монумент «Воин-освободитель»,https://ukraina.ru/20190508/1023547042.html,Андрей  Манчук,"8 мая 2019, 17:14"
Луковый шок: в Украине рекордно подорожали овощи,https://ukraina.ru/20190507/1023532587.html,Андрей  Манчук,"7 мая 2019, 17:13"
Выборы в Раду — печальный прогноз,https://ukraina.ru/20190507/1023528508.html,Ростислав Ищенко,"7 мая 2019, 12:53"
Неподдающиеся: Харьковчане против казённых неонацистов,https://ukraina.ru/20190507/1023525222.html,Константин Кеворкян,"7 мая 2019, 09:54"
"Здравствуй, Россия! Украина, прощай навсегда!",https://ukraina.ru/20190506/1023523885.html,Андрей Бабицкий,"6 мая 2019, 18:08"
Избиратели Зеленского: будущее непредставленного большинства,https://ukraina.ru/20190506/1023521031.html,Андрей  Манчук,"6 мая 2019, 17:33"
"Комик, ставший президентом. Смешно или горько?",https://ukraina.ru/20190505/1023510374.html,Андрей Бабицкий,"5 мая 2019, 08:15"
Размером с клопа. О «лучших людях» города Харькова,https://ukraina.ru/20190505/1023509526.html,Константин Кеворкян,"5 мая 2019, 08:10"
Западники и славянофилы: историческое примирение,https://ukraina.ru/20190503/1023507578.html,Андрей Бабицкий,"3 мая 2019, 13:10"
Зеленская тоска. Мухи и люди отдельно,https://ukraina.ru/20190503/1023501417.html,Константин Кеворкян,"3 мая 2019, 08:25"
"Одесса, 2 мая: преступление и наказание",https://ukraina.ru/20190502/1023504998.html,Ростислав Ищенко,"2 мая 2019, 17:20"
Трагедия в Одессе подвела черту под украинской государственностью,https://ukraina.ru/20190502/1023504788.html,Андрей Бабицкий,"2 мая 2019, 16:46"
Неизбежная жертва Украины. Возложить баранов на алтарь Отечества,https://ukraina.ru/20190501/1023494873.html,Константин Кеворкян,"1 мая 2019, 08:15"
Первомай по-киевски: почему Украина – не Европа,https://ukraina.ru/20190430/1023491826.html,Андрей  Манчук,"30 апреля 2019, 13:42"
"Сговор олигархов. Зеленский проигрывает парламенту, потому что это выгодно Коломойскому",https://ukraina.ru/20190429/1023486182.html,Ростислав Ищенко,"29 апреля 2019, 18:14"
"Зеленский поставил точку в отношениях с Москвой, даже не вступив с нею в переговоры",https://ukraina.ru/20190429/1023483910.html,Андрей Бабицкий,"29 апреля 2019, 17:35"
Украина: страна торжествующей демократии,https://ukraina.ru/20190429/1023483468.html,Андрей  Манчук,"29 апреля 2019, 15:57"
Мой украинский стыд,https://ukraina.ru/20190426/1023469719.html,Андрей  Манчук,"26 апреля 2019, 16:03"
Веселый президент Украины. Свои плавки ближе к телу,https://ukraina.ru/20190426/1023464949.html,Руслан  Мармазов,"26 апреля 2019, 13:25"
Украина: языковый закон и политическая борьба,https://ukraina.ru/20190426/1023462400.html,Ростислав Ищенко,"26 апреля 2019, 10:10"
Клетка ненависти для русскоязычных,https://ukraina.ru/20190425/1023454583.html,Андрей  Манчук,"25 апреля 2019, 16:02"
Украина: «правосудие» победителей,https://ukraina.ru/20190425/1023453940.html,Ростислав Ищенко,"25 апреля 2019, 15:11"
"Указ Путина о гражданстве, «Минск-2» и Украина",https://ukraina.ru/20190424/1023443778.html,Василий  Стоякин,"24 апреля 2019, 18:02"
"Зеленский, моровое сообщество и европейская нация",https://ukraina.ru/20190424/1023442111.html,Ростислав Ищенко,"24 апреля 2019, 16:51"
Парад фриков: чем займутся клоуны из Верховной Рады?,https://ukraina.ru/20190424/1023441198.html,Андрей  Манчук,"24 апреля 2019, 16:40"
Глобальный террор равнодушия: от Донецка до Шри-Ланки,https://ukraina.ru/20190423/1023428056.html,Андрей  Манчук,"23 апреля 2019, 15:48"
Почему на самом деле Порошенко проиграл президентские выборы,https://ukraina.ru/20190422/1023404861.html,Захар  Виноградов,"22 апреля 2019, 07:20"
Что сделает президент Владимир Зеленский,https://ukraina.ru/20190422/1023403684.html,Андрей  Манчук,"22 апреля 2019, 07:10"
Чудес не бывает: Результат выборов — полное поражение антимайданных сил,https://ukraina.ru/20190421/1023400802.html,Василий  Стоякин,"21 апреля 2019, 21:35"
Комедия дель арте на «Олимпийском»,https://ukraina.ru/20190420/1023386504.html,Ростислав Ищенко,"20 апреля 2019, 11:20"
"Дебаты: Петр, это провал! Собирай чемоданы",https://ukraina.ru/20190419/1023384456.html,Андрей  Манчук,"19 апреля 2019, 21:54"
Франция заговорила об украинских выборах,https://ukraina.ru/20190419/1023380327.html,Андрей  Манчук,"19 апреля 2019, 18:00"
Последний шанс Украины,https://ukraina.ru/20190419/1023366352.html,Ростислав Ищенко,"19 апреля 2019, 10:22"
Последнее коломойское предупреждение,https://ukraina.ru/20190418/1023358161.html,Ростислав Ищенко,"18 апреля 2019, 15:33"
Закон о языке приближает момент демонтажа украинской государственности,https://ukraina.ru/20190417/1023349686.html,Андрей Бабицкий,"17 апреля 2019, 17:57"
"«Новый курс» Зеленского: Хуже не будет, лучше — не ждите",https://ukraina.ru/20190417/1023348984.html,Ростислав Ищенко,"17 апреля 2019, 17:15"
Российское медиасообщество возлагает на Зеленского большие надежды,https://ukraina.ru/20190416/1023334563.html,Андрей Бабицкий,"16 апреля 2019, 17:45"
Пожар в Нотр-Даме: своими глазами,https://ukraina.ru/20190416/1023328972.html,Андрей  Манчук,"16 апреля 2019, 13:42"
"Последний великий артист. «Шахта обвалится, а меня посадят»",https://ukraina.ru/20190416/1023327665.html,Руслан  Мармазов,"16 апреля 2019, 13:25"
Украинский лжепрезидент и его олигархи,https://ukraina.ru/20190416/1023328293.html,Ростислав Ищенко,"16 апреля 2019, 13:21"
"О Хрущеве, реабилитированных и космосе. В чем я не согласен со Стоякиным",https://ukraina.ru/20190415/1023312831.html,Захар  Виноградов,"15 апреля 2019, 17:04"
Третий лидер Союза. Хрущев – человек и секретарь,https://ukraina.ru/20190415/1023298816.html,Василий  Стоякин,"15 апреля 2019, 16:23"
По Европе бродит новый призрак — на сей раз это война с Россией,https://ukraina.ru/20190412/1023300536.html,Андрей Бабицкий,"12 апреля 2019, 16:50"
Развал дела Савченко может стоить карьеры Луценко,https://ukraina.ru/20190411/1023291080.html,Андрей Бабицкий,"11 апреля 2019, 19:00"
Арест Ассанжа как приговор демократии,https://ukraina.ru/20190411/1023285466.html,Андрей  Манчук,"11 апреля 2019, 16:38"
"За кого вы, фрау Меркель? К визиту Петра Порошенко в Германию",https://ukraina.ru/20190411/1023284800.html,Константин Кеворкян,"11 апреля 2019, 14:44"
Порошенко ломает схему,https://ukraina.ru/20190411/1023280513.html,Ростислав Ищенко,"11 апреля 2019, 11:41"
Ставка Меркель. Германия — за Порошенко и против Украины,https://ukraina.ru/20190410/1023276039.html,Ростислав Ищенко,"10 апреля 2019, 17:06"
Украинский Пирожок с ушами,https://ukraina.ru/20190410/1023275185.html,Андрей  Манчук,"10 апреля 2019, 17:04"
Достижения декоммунизации: Что за 4 года сломали и запретили в Украине,https://ukraina.ru/20190409/1023265242.html,Андрей  Манчук,"9 апреля 2019, 18:02"
Европа меняет вектор политики в отношении России,https://ukraina.ru/20190409/1023262046.html,Андрей Бабицкий,"9 апреля 2019, 15:43"
Не идите на поводу у ненавистников: добрый совет кандидату Зеленскому,https://ukraina.ru/20190409/1023261483.html,Константин Кеворкян,"9 апреля 2019, 14:47"
Почему Зеленский уже проиграл дебаты Порошенко,https://ukraina.ru/20190409/1023260876.html,Андрей Бабицкий,"9 апреля 2019, 14:31"
Бунт одесского губернатора: чиновники бегут с президентского корабля,https://ukraina.ru/20190408/1023252288.html,Андрей  Манчук,"8 апреля 2019, 16:56"
Изображая жертву. Почему в Польше до сих пор ждут нашествия Красной армии,https://ukraina.ru/20190408/1023248936.html,Андрей Бабицкий,"8 апреля 2019, 13:59"
"Три дня, которые потрясли Харьков. Краткая история ХНР",https://ukraina.ru/20190408/1023247327.html,Константин Кеворкян,"8 апреля 2019, 12:38"
"С чувством глубокой благодарности. Порошенко, подыгрывая Трампу, может посадить в тюрьму экс-вице-президента США Байдена",https://ukraina.ru/20190405/1023235065.html,Андрей Бабицкий,"5 апреля 2019, 17:01"
Дебаты. На что надеется Петр Порошенко,https://ukraina.ru/20190405/1023232530.html,Андрей  Манчук,"5 апреля 2019, 14:42"
Украинские дебаты: постмодернизм vs новая искренность. О чем Зеленский спросит Порошенко,https://ukraina.ru/20190405/1023231706.html,Василий  Стоякин,"5 апреля 2019, 14:01"
Пустые хлопоты: НАТО обещает помочь Украине в Керченском проливе,https://ukraina.ru/20190404/1023220268.html,Андрей Бабицкий,"4 апреля 2019, 16:45"
Война вместо мира. Предвыборный угар милитаризма на Украине,https://ukraina.ru/20190404/1023219803.html,Константин Кеворкян,"4 апреля 2019, 16:34"
От Нерона до Порошенко. В дебатах на стадионах Рима и Константинополя побеждали «зеленые»,https://ukraina.ru/20190404/1023217015.html,Андрей  Манчук,"4 апреля 2019, 14:24"
Коломойский разыграл на выборах гоголевского «Ревизора»,https://ukraina.ru/20190403/1023208049.html,Андрей Бабицкий,"3 апреля 2019, 17:40"
Тринадцать миллионов украинцев могут лишиться медицинских услуг,https://ukraina.ru/20190403/1023205332.html,Андрей  Манчук,"3 апреля 2019, 16:23"
Истинный украинец. К юбилею Виктора Садовничего,https://ukraina.ru/20190403/1023205465.html,Константин Кеворкян,"3 апреля 2019, 16:15"
Выборы и бои на румынской границе,https://ukraina.ru/20190402/1023195701.html,Андрей  Манчук,"2 апреля 2019, 21:44"
Обреченные на «демократию». Что западные послы на Украине считают эталоном свободы,https://ukraina.ru/20190402/1023181653.html,Константин Кеворкян,"2 апреля 2019, 10:19"
Идеальный план действий для Петра Порошенко,https://ukraina.ru/20190401/1023178601.html,Василий  Стоякин,"1 апреля 2019, 17:21"
Украинские выборы: взгляд из Донецка,https://ukraina.ru/20190401/1023177751.html,Андрей Бабицкий,"1 апреля 2019, 17:00"
Утомленные дятлами. Легенда о древней Украинии,https://ukraina.ru/20190401/1023168128.html,Константин Кеворкян,"1 апреля 2019, 07:10"
Почему Юлия Тимошенко проиграла президентские выборы в Украине,https://ukraina.ru/20190401/1023167344.html,Андрей  Манчук,"1 апреля 2019, 01:09"
Кто победит: Прогноз результатов выборов президента Украины,https://ukraina.ru/20190331/1023163584.html,Василий  Стоякин,"31 марта 2019, 20:28"
Украина после выборов,https://ukraina.ru/20190331/1023138921.html,Ростислав Ищенко,"31 марта 2019, 08:13"
Первая столица против второй. Что творилось в Харькове и вокруг него 5 лет назад,https://ukraina.ru/20190330/1023139281.html,Константин Кеворкян,"30 марта 2019, 10:09"
Европа в украинских выборах,https://ukraina.ru/20190330/1023111074.html,Ростислав Ищенко,"30 марта 2019, 06:25"
"«Слуга народа»: сказка о том, как президент Зеленский помирил Галичину и Донбасс",https://ukraina.ru/20190329/1023143261.html,Андрей  Манчук,"29 марта 2019, 15:34"
Главная новость на Украине: строительство «Северного потока – 2» может растянуться на годы,https://ukraina.ru/20190328/1023127440.html,Андрей Бабицкий,"28 марта 2019, 15:37"
Украинские выборы. Сбрось ПАПа с поезда,https://ukraina.ru/20190327/1023108825.html,Константин Кеворкян,"27 марта 2019, 11:23"
На Украине уравняли в правах победителей в Великой Отечественной войне и их врагов,https://ukraina.ru/20190326/1023102247.html,Андрей Бабицкий,"26 марта 2019, 17:39"
Хитрый план Зеленского? Странные заявления накануне ожидаемой победы,https://ukraina.ru/20190325/1023089240.html,Константин Кеворкян,"25 марта 2019, 18:31"
Об украинской цензуре – с брезгливостью,https://ukraina.ru/20190325/1023080553.html,Константин Кеворкян,"25 марта 2019, 11:21"
Цели «Азова»: какой видят Украину нацисты,https://ukraina.ru/20190323/1023074650.html,Андрей  Манчук,"23 марта 2019, 14:54"
Надувная свинка как символ радикальной революции,https://ukraina.ru/20190323/1023073598.html,Ростислав Ищенко,"23 марта 2019, 11:16"
Станет ли Зеленский защитником русских Украины,https://ukraina.ru/20190322/1023071631.html,Андрей Бабицкий,"22 марта 2019, 19:11"
Было бы счастье. Но на Украине и несчастье не помогло,https://ukraina.ru/20190322/1023072489.html,Константин Кеворкян,"22 марта 2019, 19:10"
Порошенко и США. С их сукиным сыном - без вариантов,https://ukraina.ru/20190322/1023066820.html,Василий  Стоякин,"22 марта 2019, 16:43"
Украина глазами порохобота,https://ukraina.ru/20190322/1023062080.html,Василий  Стоякин,"22 марта 2019, 12:59"
"Вмешательство в американские выборы было. Но не российское, а украинское",https://ukraina.ru/20190321/1023055224.html,Андрей Бабицкий,"21 марта 2019, 16:43"
Как это было в марте 2014 года на улицах Харькова,https://ukraina.ru/20190321/1023051289.html,Константин Кеворкян,"21 марта 2019, 13:20"
Украина заколотила последний гвоздь в собственную ГТС и обвинила в этом Россию,https://ukraina.ru/20190320/1023043544.html,Андрей Бабицкий,"20 марта 2019, 17:40"
Метро и война. Таблетка памяти для Петра Порошенко,https://ukraina.ru/20190320/1023044262.html,Андрей  Манчук,"20 марта 2019, 17:39"
"Нурсултан Назарбаев: уйти, чтобы остаться",https://ukraina.ru/20190320/1023038618.html,Ростислав Ищенко,"20 марта 2019, 14:51"
Лицемерное прозрение. На Украине нацистов назвали нацистами,https://ukraina.ru/20190320/1023033401.html,Константин Кеворкян,"20 марта 2019, 10:28"
"Забудьте: Украине не вернуть Крым ни войной, ни миром",https://ukraina.ru/20190319/1023028476.html,Андрей Бабицкий,"19 марта 2019, 17:08"
"Вы будете смеяться, но Порошенко опять обещает вернуть Крым и Донбасс",https://ukraina.ru/20190319/1023024729.html,Василий  Стоякин,"19 марта 2019, 14:46"
Юбилей НАТО: 70 лет на страже интересов США,https://ukraina.ru/20190319/1023019687.html,Ростислав Ищенко,"19 марта 2019, 11:21"
Ультраправый украинский террорист шокировал Англию,https://ukraina.ru/20190318/1023013959.html,Андрей  Манчук,"18 марта 2019, 17:50"
«Таврида» и Крымский мост своими глазами. В день начала второй пятилетки,https://ukraina.ru/20190318/1023008547.html,Константин Кеворкян,"18 марта 2019, 12:44"
Возвращение Крыма: проблемы и перспективы,https://ukraina.ru/20190318/1023004698.html,Ростислав Ищенко,"18 марта 2019, 09:58"
Между чумой и холерой. «Свинопад» в «День гнева»,https://ukraina.ru/20190316/1023000471.html,Андрей  Манчук,"16 марта 2019, 18:29"
Крым как образ новой России,https://ukraina.ru/20190315/1022992469.html,Андрей Бабицкий,"15 марта 2019, 16:53"
Теракт в Новой Зеландии: черный след украинских нацистов,https://ukraina.ru/20190315/1022990054.html,Андрей  Манчук,"15 марта 2019, 14:32"
С дураками потерять. О взаимосвязи идеологии и нищеты государства,https://ukraina.ru/20190315/1022985658.html,Константин Кеворкян,"15 марта 2019, 10:59"
Слава или позор? Порошенко пытается привлечь на свою сторону военных,https://ukraina.ru/20190314/1022981109.html,Андрей Бабицкий,"14 марта 2019, 17:46"
Американская соломка для украинских провокаторов,https://ukraina.ru/20190314/1022971668.html,Ростислав Ищенко,"14 марта 2019, 10:07"
Киевский синдром. Элита против народа,https://ukraina.ru/20190314/1022972376.html,Константин Кеворкян,"14 марта 2019, 09:38"
