title,link,author,date_str
КНР по-американски. Лос-Анжелес на пути из США в Калифорнийскую Народную Республику,https://ukraina.ru/20250610/knr-po-amerikanski-los-anzheles-na-puti-iz-ssha-v-kaliforniyskuyu-narodnuyu-respubliku-1063817273.html,Владимир Скачко,15:19
Задача 6 тысяч тел. Что придумал Зеленский для мистификации обмена телами погибших солдат,https://ukraina.ru/20250609/zadacha-6-tysyach-tel-chto-pridumal-zelenskiy-dlya-mistifikatsii-obmena-telami-pogibshikh-soldat-1063797895.html,Михаил Павлив,"Вчера, 17:51"
"Украинский бунт: бессмысленный, беспощадный, нереальный",https://ukraina.ru/20250609/ukrainskiy-bunt-bessmyslennyy-besposchadnyy-nerealnyy-1063793638.html,Василий  Стоякин,"Вчера, 17:33"
Неоднозначные расчеты антирампистов. Европа тянет Трампа на войну покорностью и страхом Зеленского,https://ukraina.ru/20250609/neodnoznachnye-raschety-antirampistov-evropa-tyanet-trampa-na-voynu-pokornostyu-i-strakhom-zelenskogo-1063789836.html,Владимир Скачко,"Вчера, 17:22"
Мир на грани. На грани чего?,https://ukraina.ru/20250609/mir-na-grani-na-grani-chego-1063767900.html,Дмитрий Выдрин,"Вчера, 04:25"
Дорога в ад ускорилась. Украинские неонацисты уже избавились от человеческого облика,https://ukraina.ru/20250607/doroga-v-ad-uskorilas-ukrainskie-neonatsisty-uzhe-izbavilis-ot-chelovecheskogo-oblika-1063747742.html,Владимир Скачко,"7 июня, 20:38"
Возмездие неминуемо. Почему разговор Путина и Трампа не приведет к миру и что готовит Украина,https://ukraina.ru/20250605/vozmezdie-neminuemo-pochemu-razgovor-putina-i-trampa-ne-privedet-k-miru-i-chto-gotovit-ukraina-1063659477.html,Владимир Скачко,"5 июня, 17:45"
Секретная цель визита Ермака в Вашингтон,https://ukraina.ru/20250605/sekretnaya-tsel-vizita-ermaka-v-vashington-1063653210.html,Михаил Павлив,"5 июня, 10:46"
"Неанонсированный ""контрнаступ""",https://ukraina.ru/20250604/neanonsirovannyy-kontrnastup-1063635105.html,Василий  Стоякин,"4 июня, 15:50"
Основы для новой социально-экономической модели России,https://ukraina.ru/20250604/osnovy-dlya-novoy-sotsialno-ekonomicheskoy-modeli-rossii-1063596208.html,Владимир Видеманн,"4 июня, 06:21"
"Ермак головного мозга украинских неонацистов. Он хочет спасти власть либо для Зеленского, либо для себя",https://ukraina.ru/20250603/ermak-golovnogo-mozga-ukrainskikh-neonatsistov-on-khochet-spasti-vlast-libo-dlya-zelenskogo-libo-dlya-1063597552.html,Владимир Скачко,"3 июня, 15:43"
Война и социальная инженерия. Как победить в информационном сражении за Новороссию,https://ukraina.ru/20250603/voyna-i-sotsialnaya-inzheneriya-kak-pobedit-v-informatsionnom-srazhenii-za-novorossiyu-1063588799.html,Александр Дмитриевский,"3 июня, 04:40"
"Профессора с двойным дном: что скрывают китайские интеллектуалы, критикуя Россию",https://ukraina.ru/20250603/professora-s-dvoynym-dnom-chto-skryvayut-kitayskie-intellektualy-kritikuya-rossiyu-1063588465.html,Ван Чарльз,"3 июня, 04:19"
Новый раунд переговоров России и Украины – призрак компромисса. Что осталось за кулисами,https://ukraina.ru/20250602/novyy-raund-peregovorov-rossii-i-ukrainy--prizrak-kompromissa-chto-ostalos-za-kulisami-1063586239.html,Михаил Павлив,"2 июня, 20:16"
БПЛА против стратегической авиации: перемога без победы. О диверсиях на военных аэродромах России,https://ukraina.ru/20250602/bpla-protiv-strategicheskoy-aviatsii-peremoga-bez-pobedy-o-diversiyakh-na-voennykh-aerodromakh-rossii--1063572453.html,Василий  Стоякин,"2 июня, 13:58"
Мечтать не вредно. А жить?,https://ukraina.ru/20250602/mechtat-ne-vredno-a-zhit-1063561796.html,Дмитрий Выдрин,"2 июня, 06:45"
Так входила война. 2 июня 2014 года бандеровцы нанесли авиационный удар по центру Луганска,https://ukraina.ru/20250602/tak-vkhodila-voyna-2-iyunya-2014-goda-banderovtsy-nanesli-aviatsionnyy-udar-po-tsentru-luganska-1063560866.html,Александр Дмитриевский,"2 июня, 02:16"
Стамбул-2: театр абсурда,https://ukraina.ru/20250601/stambul-2-teatr-absurda-1063554134.html,Василий  Стоякин,"1 июня, 15:46"
Подрывы на ЖД – атака глобалистов!,https://ukraina.ru/20250601/podryvy-na-zhd--ataka-globalistov-1063553794.html,Михаил Павлив,"1 июня, 14:41"
"Украинский режим Зеленского подтвердил, что с ним нельзя договариваться, его можно только уничтожить",https://ukraina.ru/20250601/ukrainskiy-rezhim-zelenskogo-podtverdil-chto-s-nim-nelzya-dogovarivatsya-ego-mozhno-tolko-unichtozhit-1063552904.html,Захар  Виноградов,"1 июня, 14:07"
"Союзники, предавшие США",https://ukraina.ru/20250531/soyuzniki-predavshie-ssha-1063543501.html,Ростислав Ищенко,"31 мая, 17:08"
Марьяна Безуглая – четвертый всадник украинского апокалипсиса,https://ukraina.ru/20250531/maryana-bezuglaya--chetvertyy-vsadnik-ukrainskogo-apokalipsisa-1063538517.html,Михаил Павлив,"31 мая, 15:36"
Особенности украинской катастрофы,https://ukraina.ru/20250531/osobennosti-ukrainskoy-katastrofy-1063541238.html,Ростислав Ищенко,"31 мая, 15:26"
Путь из бандеровской неволи. Как мы должны бороться за возвращение жителей оккупированных территорий,https://ukraina.ru/20250531/put-iz-banderovskoy-nevoli-kak-my-dolzhny-borotsya-za-vozvraschenie-zhiteley-okkupirovannykh-territoriy-1063538980.html,Александр Дмитриевский,"31 мая, 11:14"
Что скрывает власть. Закрытая социология на Украине,https://ukraina.ru/20250531/chto-skryvaet-vlast-zakrytaya-sotsiologiya-na-ukraine-1063536826.html,Михаил Павлив,"31 мая, 10:11"
Украина как антисистема,https://ukraina.ru/20250531/ukraina-kak-antisistema-1063534935.html,Ростислав Ищенко,"31 мая, 07:31"
Дадут ли европейцы Зеленскому 30 миллиардов? Несбытча мечт,https://ukraina.ru/20250531/dadut-li-evropeytsy-zelenskomu-30-milliardov-nesbytcha-mecht-1063534134.html,Михаил Павлив,"31 мая, 06:24"
"Келлог, ""разрывающий пасть"" НАТО",https://ukraina.ru/20250531/kellog-razryvayuschiy-past-nato-1063534565.html,Ростислав Ищенко,"31 мая, 06:12"
Нардеп Украины Марьяна Безуглая – она же Марьяна безумная! Почему ей так много позволено,https://ukraina.ru/20250530/nardep-ukrainy-maryana-bezuglaya--ona-zhe-maryana-bezumnaya-pochemu-ey-tak-mnogo-pozvoleno-1063532070.html,Михаил Павлив,"30 мая, 19:57"
"Призрак ""украинской федерации"" и  парадоксы федералистской риторики",https://ukraina.ru/20250530/prizrak-ukrainskoy-federatsii-i--paradoksy-federalistskoy-ritoriki-1063514150.html,Василий  Стоякин,"30 мая, 13:52"
"Украина меняет тактику - проигрывая на земле, хочет создать нам ад с неба",https://ukraina.ru/20250530/ukraina-menyaet-taktiku---proigryvaya-na-zemle-khochet-sozdat-nam-ad-s-neba-1063498994.html,Алексей Туманов,"30 мая, 12:19"
Почему Зеленский решил убрать Буданова* и как это связано с назначением нового посла США на Украине,https://ukraina.ru/20250530/pochemu-zelenskiy-reshil-ubrat-budanova-i-kak-eto-svyazano-s-naznacheniem-novogo-posla-ssha-na-ukraine-1063510341.html,Михаил Павлив,"30 мая, 11:54"
Морская экспансия Европейского союза,https://ukraina.ru/20250530/morskaya-ekspansiya-evropeyskogo-soyuza-1063507285.html,Ростислав Ищенко,"30 мая, 08:14"
"""Si vis pacem, para bellum"" от ЕС и ОДКБ. Противники готовятся к ""безопасной схватке""",https://ukraina.ru/20250529/si-vis-pacem-para-bellum-ot-es-i-odkb-protivniki-gotovyatsya-k-bezopasnoy-skhvatke--1063495085.html,Владимир Скачко,"29 мая, 17:19"
День независимости Грузии. Мысленное путешествие в чудесный мир дипломатических недоговорённостей,https://ukraina.ru/20250529/den-nezavisimosti-gruzii-myslennoe-puteshestvie-v-chudesnyy-mir-diplomaticheskikh-nedogovornnostey-1063492260.html,Василий  Стоякин,"29 мая, 15:35"
Мастер-класс между раундами переговоров,https://ukraina.ru/20250529/master-klass-mezhdu-raundami-peregovorov-1063480420.html,Ростислав Ищенко,"29 мая, 10:02"
Лев готовится к броску.  Папа Римский опять замыслил глобальный католицизм для всего мира,https://ukraina.ru/20250528/lev-gotovitsya-k-brosku--papa-rimskiy-opyat-zamyslil-globalnyy-katolitsizm-dlya-vsego-mira-1063476634.html,Владимир Скачко,"28 мая, 21:14"
Инсайд из США. Кто новый куратор Украины в Вашингтоне и кто будет подписывать перемирие от Украины,https://ukraina.ru/20250528/insayd-iz-ssha-kto-novyy-kurator-ukrainy-v-vashingtone-i-kto-budet-podpisyvat-peremirie-ot-ukrainy-1063474906.html,Михаил Павлив,"28 мая, 19:54"
Шахтеры и роботы. Как из разрухи и разорения извлечь Донбассу прибыль,https://ukraina.ru/20250528/shakhtery-i-roboty-kak-iz-razrukhi-i-razoreniya-izvlech-donbassu-pribyl-1063459026.html,Александр Дмитриевский,"28 мая, 13:26"
Харьков или Одесса,https://ukraina.ru/20250528/kharkov-ili-odessa-1063451698.html,Ростислав Ищенко,"28 мая, 09:59"
Стратегический тупик Запада,https://ukraina.ru/20250528/strategicheskiy-tupik-zapada-1063450745.html,Ростислав Ищенко,"28 мая, 05:36"
Голубые укро-сосиски Стармера. Британский премьер спасает свой секс-имидж в войне,https://ukraina.ru/20250527/golubye-ukro-sosiski-starmera-britanskiy-premer-spasaet-svoy-seks-imidzh-v-voyne-1063438383.html,Владимир Скачко,"27 мая, 19:04"
"Как сбываются предсказания. Станислав Лем и военная ""эволюция вверх ногами""",https://ukraina.ru/20250527/kak-sbyvayutsya-predskazaniya-stanislav-lem-i-voennaya-evolyutsiya-vverkh-nogami-1063437050.html,Василий  Стоякин,"27 мая, 15:21"
"Балтийские игры забытых ""тигров""",https://ukraina.ru/20250527/baltiyskie-igry-zabytykh-tigrov-1063425940.html,Ростислав Ищенко,"27 мая, 04:45"
Трамп по-прежнему выбирает войну. Мирными речами никого обмануть ему не удалось,https://ukraina.ru/20250526/tramp-po-prezhnemu-vybiraet-voynu-mirnymi-rechami-nikogo-obmanut-emu-ne-udalos-1063417343.html,Владимир Скачко,"26 мая, 16:59"
Причины и смысл катастрофы западной цивилизации,https://ukraina.ru/20250526/prichiny-i-smysl-katastrofy-zapadnoy-tsivilizatsii-1063408219.html,Ростислав Ищенко,"26 мая, 06:52"
"""Ну, за уважение!"" Трамп",https://ukraina.ru/20250526/nu-za-uvazhenie-tramp-1063407800.html,Дмитрий Выдрин,"26 мая, 06:06"
Три героя одной подписи. Но нацизм они уничтожали не только росчерком пера,https://ukraina.ru/20250524/tri-geroya-odnoy-podpisi-no-natsizm-oni-unichtozhali-ne-tolko-roscherkom-pera-1063014110.html,Владимир Скачко,"24 мая, 08:02"
"Полтава и Одесса требуют денацификации. Память о России продолжают зачищать, потому что проплачено",https://ukraina.ru/20250523/poltava-i-odessa-trebuyut-denatsifikatsii-pamyat-o-rossii-prodolzhayut-zachischat-potomu-chto-proplacheno-1063367787.html,Владимир Скачко,"23 мая, 16:27"
Так кто же заказал Андрея Портнова?,https://ukraina.ru/20250523/tak-kto-zhe-zakazal-andreya-portnova-1063350397.html,Михаил Павлив,"23 мая, 10:46"
Отсутствие предпосылок для мира,https://ukraina.ru/20250523/otsutstvie-predposylok-dlya-mira-1063348994.html,Ростислав Ищенко,"23 мая, 10:00"
Грядущее Дикое поле. Как депопуляция будет препятствовать восстановлению Малороссии и Слобожанщины,https://ukraina.ru/20250522/gryaduschee-dikoe-pole-kak-depopulyatsiya-budet-prepyatstvovat-vosstanovleniyu-malorossii-i-slobozhanschiny--1063322522.html,Александр Дмитриевский,"22 мая, 13:17"
"Что будет, если Киев сорвет мирные переговоры и война продолжится?",https://ukraina.ru/20250522/chto-budet-esli-kiev-sorvet-mirnye-peregovory-i-voyna-prodolzhitsya-1063323934.html,Михаил Павлив,"22 мая, 12:47"
Замещение памяти и совести. Как Гитлер подвел украинских неонацистов,https://ukraina.ru/20250522/zameschenie-pamyati-i-sovesti-kak-gitler-podvel-ukrainskikh-neonatsistov-1063318311.html,Владимир Скачко,"22 мая, 04:52"
Что не так с переговорами по Украине,https://ukraina.ru/20250521/chto-ne-tak-s-peregovorami-po-ukraine-1063313939.html,Захар  Виноградов,"21 мая, 19:30"
"Что мешает переговорам: ещё раз о ""запрете"" и легитимности",https://ukraina.ru/20250521/chto-meshaet-peregovoram-esch-raz-o-zaprete-i-legitimnosti-1063305685.html,Василий  Стоякин,"21 мая, 16:12"
"О чем на самом деле договорились Путин и Трамп, почему украинцы в Стамбуле были корректны и кто победил",https://ukraina.ru/20250521/o-chem-na-samom-dele-dogovorilis-putin-i-tramp-pochemu-ukraintsy-v-stambule-byli-korrektny-i-kto-1063289654.html,Михаил Павлив,"21 мая, 13:45"
Магическая цифра шесть: к годовщине инаугурации Зеленского,https://ukraina.ru/20250520/magicheskaya-tsifra-shest-k-godovschine-inauguratsii-zelenskogo-1063270598.html,Василий  Стоякин,"20 мая, 15:28"
"""Демократия – ффсе!"" Выводы из проката президентских выборов в Румынии",https://ukraina.ru/20250520/demokratiya--ffse-vyvody-iz-prokata-prezidentskikh-vyborov-v-rumynii---1063266961.html,Владимир Скачко,"20 мая, 14:05"
Украинские бумеранги британского премьера. 9 лиц Кира Стармера: от пособника педофилии до русофобии,https://ukraina.ru/20250519/ukrainskie-bumerangi-britanskogo-premera-9-lits-kira-starmera-ot-posobnika-pedofilii-do-rusofobii---1063244405.html,Владимир Скачко,"19 мая, 17:53"
Мордоделы за работой: как и зачем строят имидж Зеленского,https://ukraina.ru/20250519/mordodely-za-rabotoy-kak-i-zachem-stroyat-imidzh-zelenskogo-1063249239.html,Василий  Стоякин,"19 мая, 17:26"
"""На дальнем юге в городе Стамбуле…""",https://ukraina.ru/20250519/na-dalnem-yuge-v-gorode-stambule-1063226168.html,Дмитрий Выдрин,"19 мая, 04:43"
О формате устойчивого планетарного мира,https://ukraina.ru/20250518/o-formate-ustoychivogo-planetarnogo-mira-1063224647.html,Ростислав Ищенко,"18 мая, 21:11"
Мир после СВО и четыре психо-политических источника роста русофобии,https://ukraina.ru/20250517/mir-posle-svo-i-chetyre-psikho-politicheskikh-istochnika-rosta-rusofobii-1063210668.html,Ван Чарльз,"17 мая, 17:15"
"""Стамбул"" или все же ""Гомель""? Кто победил в переговорах на первом этапе 2025-го года",https://ukraina.ru/20250517/stambul-pervyy-raund-za-rossiey-1063209515.html,Михаил Павлив,"17 мая, 15:54"
"Андрей Ганжа: он жил в другом мире, а умер в этом",https://ukraina.ru/20250515/andrey-ganzha-on-zhil-v-drugom-mire-a-umer-v-etom-1063149751.html,Владимир Скачко,"15 мая, 20:52"
Не забыть о людях. Переговоры в Стамбуле и гражданские пленные,https://ukraina.ru/20250515/ne-zabyt-o-lyudyakh-peregovory-s-stambule-i-grazhdanskie-plennye-1063140469.html,Павел Волков,"15 мая, 10:25"
"""Лев мира"" на тропе войны. Папа Римский будет мирно подчинять православие",https://ukraina.ru/20250514/lev-mira-na-trope-voyny-papa-rimskiy-budet-mirno-podchinyat-pravoslavie-1063131797.html,Владимир Скачко,"14 мая, 21:34"
Переговоры как опасность,https://ukraina.ru/20250514/peregovory-kak-opasnost-1063109926.html,Ростислав Ищенко,"14 мая, 09:37"
С чем Зеленский поедет в Стамбул: послание от социологов украинского центра имени Разумкова,https://ukraina.ru/20250513/s-chem-zelenskiy-poedet-v-stambul-poslanie-ot-sotsiologov-ukrainskogo-tsentra-imeni-razumkova-1063090842.html,Василий  Стоякин,"13 мая, 13:58"
"Для США Украина - отработанный кейс, важнее, как сложатся отношения с Россией и что будет потом",https://ukraina.ru/20250513/dlya-ssha-ukraina---otrabotannyy-keys-vazhnee-kak-slozhatsya-otnosheniya-s-rossiey-i-chto-budet-potom-1063082852.html,Михаил Павлив,"13 мая, 12:26"
"Воспитание ""пабедабесия""*: праздники в зеркале украинской социологии",https://ukraina.ru/20250512/vospitanie-pabedabesiya-prazdniki-v-zerkale-ukrainskoy-sotsiologii--1063063687.html,Василий  Стоякин,"12 мая, 16:47"
Французский стыд,https://ukraina.ru/20250512/frantsuzskiy-styd-1063049512.html,Дмитрий Выдрин,"12 мая, 07:26"
Ренессанс товарища Сталина. В Мелитополе открыли первый памятник организатору Великой Победы,https://ukraina.ru/20250511/renessans-tovarischa-stalina-v-melitopole-otkryli-pervyy-pamyatnik-organizatoru-velikoy-pobedy-1063044261.html,Владимир Скачко,"11 мая, 14:49"
"Папа американского меньшинства. Лев XIV, как и Трамп, хочет сделать влияние католиков глобальным",https://ukraina.ru/20250511/papa-amerikanskogo-menshinstva-lev-xiv-kak-i-tramp-khochet-sdelat-vliyanie-katolikov-globalnym-1063037291.html,Владимир Скачко,"11 мая, 05:49"
Самоотравление страданием. Как у украинцев украли Победу и насадили поражения,https://ukraina.ru/20250509/samootravlenie-stradaniem-kak-u-ukraintsev-ukrali-pobedu-i-nasadili-porazheniya-1063021625.html,Александр Дмитриевский,"9 мая, 07:38"
Роль Второй Речи Посполитой в нашей Великой Победе,https://ukraina.ru/20250509/rol-vtoroy-rechi-pospolitoy-v-nashey-velikoy-pobede-1063020771.html,Ростислав Ищенко,"9 мая, 06:03"
Четверть века Путина,https://ukraina.ru/20250507/chetvert-veka-putina-1062995328.html,Василий  Стоякин,"7 мая, 17:18"
Трамп заговорил о преемнике. Война и политический маразм обязывают подумать о вечности,https://ukraina.ru/20250506/tramp-zagovoril-o-preemnike-voyna-i-politicheskiy-marazm-obyazyvayut-podumat-o-vechnosti--1062963277.html,Владимир Скачко,"6 мая, 22:30"
Немного о денацификации. Неплановое последствие СВО,https://ukraina.ru/20250506/nemnogo-o-denatsifikatsii-neplanovoe-posledstvie-svo-1062968693.html,Василий  Стоякин,"6 мая, 16:21"
Победители vs обиженные. Геополитика,https://ukraina.ru/20250505/pobediteli-vs-obizhennykh-geopolitika-1062924945.html,Дмитрий Выдрин,"5 мая, 09:30"
"Как США, как им кажется, победили всех. Трамп готовит себя и Зеленского к войне с Россией",https://ukraina.ru/20250504/kak-ssha-pobedili-vsekh-tramp-gotovit-sebya-i-zelenskogo-k-voyne-s-rossiey-1062913191.html,Владимир Скачко,"4 мая, 11:58"
Скандальная сделка США и Украины по ресурсам. Что на самом деле сделал Трамп с Украиной,https://ukraina.ru/20250501/skandalnaya-sdelka-ssha-i-ukrainy-po-resursam-chto-na-samom-dele-sdelal-tramp-s-ukrainoy-1062894881.html,Михаил Павлив,"1 мая, 20:18"
Трамп дожал Зеленского на сделку. Как случилась распродажа исчезающей страны по дешевке,https://ukraina.ru/20250501/tramp-dozhal-zelenskogo-na-sdelku-kak-sluchilas-rasprodazha-ischezayuschey-strany-po-deshevke-1062891932.html,Владимир Скачко,"1 мая, 14:47"
"Возвращение украденного. Россия не забирает чужое, а возвращает свое",https://ukraina.ru/20250430/vozvraschenie-ukradennogo-rossiya-ne-zabiraet-chuzhoe-a-vozvraschaet-svoe-1062884608.html,Ростислав Ищенко,"30 апреля, 23:06"
"Вежливость не значит слабость. Не принимая сегодня условия Путина, Зеленский рискует остаться с дыркой",https://ukraina.ru/20250430/vezhlivost-ne-znachit-slabost-ne-prinimaya-segodnya-usloviya-putina-zelenskiy-riskuet-ostatsya-s-1062874149.html,Алексей Туманов,"30 апреля, 22:42"
Войне все возрасты покорны. Украина как гигантская соковыжималка Зеленского,https://ukraina.ru/20250430/voyne-vse-vozrasty-pokorny-ukraina-kak-gigantskaya-sokovyzhimalka-zelenskogo-1062883264.html,Ростислав Ищенко,"30 апреля, 20:59"
Террор в назидание. Зеленский хочет запачкать Трампа в кровопролитии,https://ukraina.ru/20250430/terror-v-nazidanie-zelenskiy-khochet-zapachkat-trampa-v-krovoprolitii-1062882890.html,Владимир Скачко,"30 апреля, 20:41"
Сумбур вместо Ватерлоо. О ста днях Трампа,https://ukraina.ru/20250430/sumbur-vmesto-vaterloo-1062882134.html,Ростислав Ищенко,"30 апреля, 20:21"
"Лингвоцид с бутылкой. Как ""сукино дите"" выбивает русский язык в Украине",https://ukraina.ru/20250429/lingvotsid-s-butylkoy-kak-sukino-dite-vybivaet-russkiy-yazyk-v-ukraine-1062839417.html,Владимир Скачко,"29 апреля, 18:02"
"""Мир"" до последнего патрона",https://ukraina.ru/20250429/mir-do-poslednego-patrona-1062847505.html,Ростислав Ищенко,"29 апреля, 17:45"
"""Восемь пунктов Лаврова"" и призрак компромисса",https://ukraina.ru/20250429/vosem-punktov-lavrova-i-prizrak-kompromissa--1062841352.html,Василий  Стоякин,"29 апреля, 17:37"
